<?xml version="1.0" encoding="UTF-8"?>
<!--
  Copyright Safris Software 2008
  
  This code is free software: you can redistribute it and/or modify
  it under the terms of the GNU General Public License as published by
  the Free Software Foundation, either version 3 of the License, or
  (at your option) any later version.
  
  This program is distributed in the hope that it will be useful,
  but WITHOUT ANY WARRANTY; without even the implied warranty of
  MERCHANTABILITY or FITNESS FOR A PARTICULAR PURPOSE.  See the
  GNU General Public License for more details.
  
  You should have received a copy of the GNU General Public License
  along with this program.  If not, see <http://www.gnu.org/licenses/>.
-->

<startingPoints
  xmlns="http://ide.safris.org/common/starting-points.xsd"
  xmlns:xsi="http://www.w3.org/2001/XMLSchema-instance"
  xsi:schemaLocation="http://ide.safris.org/common/starting-points.xsd ../../../ide/common/src/main/resources/xsd/starting-points.xsd">
  <startingPoint>
    <commandLineArguments/>
    <name>MixedTest</name>
    <target>org.safris.xml.toolkit.test.binding.MixedTest</target>
    <vmOtherOptions/>
    <workingDir>binding\</workingDir>
  </startingPoint>
  <startingPoint>
    <commandLineArguments/>
    <name>ListTest</name>
    <target>org.safris.xml.toolkit.test.binding.ListTest</target>
    <vmOtherOptions/>
    <workingDir>binding\</workingDir>
  </startingPoint>
  <startingPoint>
    <commandLineArguments/>
    <name>TypeTest</name>
    <target>org.safris.xml.toolkit.test.binding.TypeTest</target>
    <vmOtherOptions/>
    <workingDir>binding\</workingDir>
  </startingPoint>
  <startingPoint>
    <commandLineArguments/>
    <name>RedefineTest</name>
    <target>org.safris.xml.toolkit.test.binding.RedefineTest</target>
    <vmOtherOptions/>
    <workingDir>binding\</workingDir>
  </startingPoint>
  <startingPoint>
    <commandLineArguments/>
    <name>UnionTest</name>
    <target>org.safris.xml.toolkit.test.binding.UnionTest</target>
    <vmOtherOptions/>
    <workingDir>binding\</workingDir>
  </startingPoint>
  <startingPoint>
    <commandLineArguments/>
    <name>NameTest</name>
    <target>org.safris.xml.toolkit.test.binding.NameTest</target>
    <vmOtherOptions/>
    <workingDir>binding\</workingDir>
  </startingPoint>
  <startingPoint>
    <commandLineArguments/>
    <name>OrderTest</name>
    <target>org.safris.xml.toolkit.test.binding.OrderTest</target>
    <vmOtherOptions/>
    <workingDir>binding\</workingDir>
  </startingPoint>
  <startingPoint>
    <commandLineArguments/>
    <name>IteratorTest</name>
    <target>org.safris.xml.toolkit.test.binding.IteratorTest</target>
    <vmOtherOptions/>
    <workingDir>binding\</workingDir>
  </startingPoint>
</startingPoints>
