<?xml version="1.0" encoding="UTF-8"?>
<!--
  Copyright Safris Software 2008
  
  This code is free software: you can redistribute it and/or modify
  it under the terms of the GNU General Public License as published by
  the Free Software Foundation, either version 3 of the License, or
  (at your option) any later version.
  
  This program is distributed in the hope that it will be useful,
  but WITHOUT ANY WARRANTY; without even the implied warranty of
  MERCHANTABILITY or FITNESS FOR A PARTICULAR PURPOSE.  See the
  GNU General Public License for more details.
  
  You should have received a copy of the GNU General Public License
  along with this program.  If not, see <http://www.gnu.org/licenses/>.
-->

<startingPoints
  xmlns="http://ide.safris.org/common/starting-points.xsd"
  xmlns:xsi="http://www.w3.org/2001/XMLSchema-instance"
  xsi:schemaLocation="http://ide.safris.org/common/starting-points.xsd ../../ide/common/src/main/resources/xsd/starting-points.xsd">
  <startingPoint>
    <commandLineArguments/>
    <name>DayTest</name>
    <target>org.safris.commons.xml.binding.DayTest</target>
    <vmOtherOptions/>
    <workingDir/>
  </startingPoint>
  <startingPoint>
    <commandLineArguments/>
    <name>MonthTest</name>
    <target>org.safris.commons.xml.binding.MonthTest</target>
    <vmOtherOptions/>
    <workingDir/>
  </startingPoint>
  <startingPoint>
    <commandLineArguments/>
    <name>MonthDayTest</name>
    <target>org.safris.commons.xml.binding.MonthDayTest</target>
    <vmOtherOptions/>
    <workingDir/>
  </startingPoint>
  <startingPoint>
    <commandLineArguments/>
    <name>YearTest</name>
    <target>org.safris.commons.xml.binding.YearTest</target>
    <vmOtherOptions/>
    <workingDir/>
  </startingPoint>
  <startingPoint>
    <commandLineArguments/>
    <name>YearMonthTest</name>
    <target>org.safris.commons.xml.binding.YearMonthTest</target>
    <vmOtherOptions/>
    <workingDir/>
  </startingPoint>
  <startingPoint>
    <commandLineArguments/>
    <name>DateTest</name>
    <target>org.safris.commons.xml.binding.DateTest</target>
    <vmOtherOptions/>
    <workingDir/>
  </startingPoint>
  <startingPoint>
    <commandLineArguments/>
    <name>DateTimeTest</name>
    <target>org.safris.commons.xml.binding.DateTimeTest</target>
    <vmOtherOptions/>
    <workingDir/>
  </startingPoint>
  <startingPoint>
    <commandLineArguments/>
    <name>TimeTest</name>
    <target>org.safris.commons.xml.binding.TimeTest</target>
    <vmOtherOptions/>
    <workingDir/>
  </startingPoint>
  <startingPoint>
    <commandLineArguments/>
    <name>LanguageTest</name>
    <target>org.safris.commons.xml.binding.LanguageTest</target>
    <vmOtherOptions/>
    <workingDir/>
  </startingPoint>
  <startingPoint>
    <commandLineArguments/>
    <name>DurationTest</name>
    <target>org.safris.commons.xml.binding.DurationTest</target>
    <vmOtherOptions/>
    <workingDir/>
  </startingPoint>
  <startingPoint>
    <commandLineArguments/>
    <name>NamespaceBindingTest</name>
    <target>org.safris.commons.xml.NamespaceBindingTest</target>
    <vmOtherOptions/>
    <workingDir/>
  </startingPoint>
</startingPoints>
