<?xml version="1.0" encoding="UTF-8"?>
<!--
  Copyright Safris Software 2008
  
  This code is free software: you can redistribute it and/or modify
  it under the terms of the GNU General Public License as published by
  the Free Software Foundation, either version 3 of the License, or
  (at your option) any later version.
  
  This program is distributed in the hope that it will be useful,
  but WITHOUT ANY WARRANTY; without even the implied warranty of
  MERCHANTABILITY or FITNESS FOR A PARTICULAR PURPOSE.  See the
  GNU General Public License for more details.
  
  You should have received a copy of the GNU General Public License
  along with this program.  If not, see <http://www.gnu.org/licenses/>.
-->

<startingPoints
  xmlns="http://ide.safris.org/common/starting-points.xsd"
  xmlns:xsi="http://www.w3.org/2001/XMLSchema-instance"
  xsi:schemaLocation="http://ide.safris.org/common/starting-points.xsd ../../../../ide/common/src/main/resources/xsd/starting-points.xsd">
  <startingPoint>
    <commandLineArguments>/home/safrsev/Projects/org/safris/trunk/xml/sample/binding/pom.xml</commandLineArguments>
    <name>GeneratorMojo sample/binding/pom.xml</name>
    <target>org.safris.maven.plugin.xml.binding.GeneratorMojo</target>
    <vmOtherOptions/>
    <workingDir>..\sample\binding\</workingDir>
  </startingPoint>
  <startingPoint>
    <commandLineArguments>/home/safrsev/Projects/org/safris/trunk/xml/tutorial/binding/pom.xml</commandLineArguments>
    <name>GeneratorMojo tutorial/binding/pom.xml</name>
    <target>org.safris.maven.plugin.xml.binding.GeneratorMojo</target>
    <vmOtherOptions/>
    <workingDir>..\tutorial\binding\</workingDir>
  </startingPoint>
  <startingPoint>
    <commandLineArguments>/home/safrsev/Projects/org/safris/trunk/xml/test/binding/pom.xml</commandLineArguments>
    <name>GeneratorMojo test/binding/pom.xml</name>
    <target>org.safris.maven.plugin.xml.binding.GeneratorMojo</target>
    <vmOtherOptions/>
    <workingDir>..\test\binding\</workingDir>
  </startingPoint>
  <startingPoint>
    <commandLineArguments/>
    <name>ExternalTest</name>
    <target>org.safris.maven.plugin.xml.binding.ExternalTest</target>
    <vmOtherOptions/>
    <workingDir>binding\</workingDir>
  </startingPoint>
  <startingPoint>
    <commandLineArguments/>
    <name>InternalTest</name>
    <target>org.safris.maven.plugin.xml.binding.InternalTest</target>
    <vmOtherOptions/>
    <workingDir>binding\</workingDir>
  </startingPoint>
</startingPoints>
