<?xml version="1.0" encoding="UTF-8"?>
<!--
  Copyright (c) 2008 Seva Safris
  
  Permission is hereby granted, free of charge, to any person obtaining a copy
  of this software and associated documentation files (the "Software"), to deal
  in the Software without restriction, including without limitation the rights
  to use, copy, modify, merge, publish, distribute, sublicense, and/or sell
  copies of the Software, and to permit persons to whom the Software is
  furnished to do so, subject to the following conditions:
  
  The above copyright notice and this permission notice shall be included in
  all copies or substantial portions of the Software.
  
  You should have received a copy of The MIT License (MIT) along with this
  program. If not, see <http://opensource.org/licenses/MIT/>.
-->

<startingPoints
  xmlns="http://ide.safris.org/common/starting-points.xsd"
  xmlns:xsi="http://www.w3.org/2001/XMLSchema-instance"
  xsi:schemaLocation="http://ide.safris.org/common/starting-points.xsd ../../ide/common/src/main/resources/xsd/starting-points.xsd">
  <startingPoint>
    <commandLineArguments/>
    <name>ClassesTest</name>
    <target>org.safris.commons.lang.reflect.ClassesTest</target>
    <vmOtherOptions/>
    <workingDir/>
  </startingPoint>
  <startingPoint>
    <commandLineArguments/>
    <name>ClassLoaderLocalTest</name>
    <target>org.safris.commons.lang.ClassLoaderLocalTest</target>
    <vmOtherOptions/>
    <workingDir/>
  </startingPoint>
  <startingPoint>
    <commandLineArguments/>
    <name>NumbersTest</name>
    <target>org.safris.commons.lang.NumbersTest</target>
    <vmOtherOptions/>
    <workingDir/>
  </startingPoint>
  <startingPoint>
    <commandLineArguments/>
    <name>PackageLoaderTest</name>
    <target>org.safris.commons.lang.PackageLoaderTest</target>
    <vmOtherOptions/>
    <workingDir/>
  </startingPoint>
  <startingPoint>
    <commandLineArguments/>
    <name>PathsTest</name>
    <target>org.safris.commons.lang.PathsTest</target>
    <vmOtherOptions/>
    <workingDir/>
  </startingPoint>
  <startingPoint>
    <commandLineArguments/>
    <name>ResourcesTest</name>
    <target>org.safris.commons.lang.ResourcesTest</target>
    <vmOtherOptions/>
    <workingDir/>
  </startingPoint>
  <startingPoint>
    <commandLineArguments/>
    <name>StringsTest</name>
    <target>org.safris.commons.lang.StringsTest</target>
    <vmOtherOptions/>
    <workingDir/>
  </startingPoint>
  <startingPoint>
    <commandLineArguments/>
    <name>SystemsTest</name>
    <target>org.safris.commons.lang.SystemsTest</target>
    <vmOtherOptions/>
    <workingDir/>
  </startingPoint>
</startingPoints>
